{
  "channels": [
    {
      "calibration_required": true,
      "channel_id": "field_input_q16",
      "direction": "input",
      "dtype": "int32",
      "physical_quantity": "programmed_or_sensed_field",
      "roles": [
        "operand"
      ],
      "sample_period_ns": null,
      "unit": "q16"
    },
    {
      "calibration_required": false,
      "channel_id": "relaxation_state_q16",
      "direction": "internal",
      "dtype": "int32",
      "physical_quantity": "relaxation_state",
      "roles": [
        "dynamics"
      ],
      "sample_period_ns": null,
      "unit": "q16"
    },
    {
      "calibration_required": false,
      "channel_id": "relaxed_output_q16",
      "direction": "output",
      "dtype": "int32",
      "physical_quantity": "relaxed_field",
      "roles": [
        "result"
      ],
      "sample_period_ns": null,
      "unit": "q16"
    },
    {
      "calibration_required": false,
      "channel_id": "supply",
      "direction": "internal",
      "dtype": "int32",
      "physical_quantity": "energy_supply",
      "roles": [
        "energy"
      ],
      "sample_period_ns": null,
      "unit": "joule"
    }
  ],
  "coupling_mode": "stimulate_and_observe",
  "determinism": "exact",
  "dynamics_class": "deterministic_relaxation",
  "energy_contract": {
    "evidence_class": "reference_model",
    "instrument_ref": null,
    "measurement_boundary": "unmeasured",
    "recovered_or_harvested_joules": null,
    "source_class": "external",
    "supplied_joules": null
  },
  "environment_boundary": "device terminals plus readout",
  "fallback_model_id": "leaky-integrator-fixed-point/v1",
  "operator_class": "leaky_integrator_q16",
  "optional_riscv_extension": "Xphys",
  "parameters": {
    "alpha_q16": 32768,
    "reset_state_q16": 0
  },
  "portable_binding": "physical-compute-mmio/v1",
  "realization_class": "designed_device",
  "reset_contract": "exact",
  "schema_version": "ahead.physical-substrate/v0.1",
  "state_words": 1,
  "substrate_id": "rc-relaxation-reference-v1"
}
